{
  "address": "0xe7f1725E7734CE288F8367e1Bb143E90bb3F0512",
  "abi": [
    {
      "inputs": [
        {
          "internalType": "address",
          "name": "priceFeedAddress",
          "type": "address"
        }
      ],
      "stateMutability": "nonpayable",
      "type": "constructor"
    },
    {
      "inputs": [],
      "name": "FundMe__CallFailed",
      "type": "error"
    },
    {
      "inputs": [
        {
          "internalType": "uint256",
          "name": "ethProvided",
          "type": "uint256"
        },
        {
          "internalType": "uint256",
          "name": "minEth",
          "type": "uint256"
        }
      ],
      "name": "FundMe__NotEnoughETH",
      "type": "error"
    },
    {
      "inputs": [],
      "name": "FundMe__NotOwner",
      "type": "error"
    },
    {
      "stateMutability": "payable",
      "type": "fallback"
    },
    {
      "inputs": [],
      "name": "MINIMUM_USD",
      "outputs": [
        {
          "internalType": "uint256",
          "name": "",
          "type": "uint256"
        }
      ],
      "stateMutability": "view",
      "type": "function"
    },
    {
      "inputs": [],
      "name": "OWNER",
      "outputs": [
        {
          "internalType": "address",
          "name": "",
          "type": "address"
        }
      ],
      "stateMutability": "view",
      "type": "function"
    },
    {
      "inputs": [
        {
          "internalType": "address",
          "name": "",
          "type": "address"
        }
      ],
      "name": "addressToAmountFunded",
      "outputs": [
        {
          "internalType": "uint256",
          "name": "",
          "type": "uint256"
        }
      ],
      "stateMutability": "view",
      "type": "function"
    },
    {
      "inputs": [
        {
          "internalType": "uint256",
          "name": "",
          "type": "uint256"
        }
      ],
      "name": "founders",
      "outputs": [
        {
          "internalType": "address",
          "name": "",
          "type": "address"
        }
      ],
      "stateMutability": "view",
      "type": "function"
    },
    {
      "inputs": [],
      "name": "fund",
      "outputs": [],
      "stateMutability": "payable",
      "type": "function"
    },
    {
      "inputs": [],
      "name": "getVersion",
      "outputs": [
        {
          "internalType": "uint256",
          "name": "",
          "type": "uint256"
        }
      ],
      "stateMutability": "view",
      "type": "function"
    },
    {
      "inputs": [],
      "name": "priceFeed",
      "outputs": [
        {
          "internalType": "contract AggregatorV3Interface",
          "name": "",
          "type": "address"
        }
      ],
      "stateMutability": "view",
      "type": "function"
    },
    {
      "inputs": [],
      "name": "withdraw",
      "outputs": [],
      "stateMutability": "nonpayable",
      "type": "function"
    },
    {
      "stateMutability": "payable",
      "type": "receive"
    }
  ],
  "transactionHash": "0x3ef2b558187ea6660ad9f7399b1871240e94b4f6826abd797ff1b39db6fefb03",
  "receipt": {
    "to": null,
    "from": "0xf39Fd6e51aad88F6F4ce6aB8827279cffFb92266",
    "contractAddress": "0xe7f1725E7734CE288F8367e1Bb143E90bb3F0512",
    "transactionIndex": 0,
    "gasUsed": "825448",
    "logsBloom": "0x00000000000000000000000000000000000000000000000000000000000000000000000000000000000000000000000000000000000000000000000000000000000000000000000000000000000000000000000000000000000000000000000000000000000000000000000000000000000000000000000000000000000000000000000000000000000000000000000000000000000000000000000000000000000000000000000000000000000000000000000000000000000000000000000000000000000000000000000000000000000000000000000000000000000000000000000000000000000000000000000000000000000000000000000000000000",
    "blockHash": "0x0370a8ad27dce89aafc01e408194d2d6b04ca36a47fe3bd94a2afa327d6bc4bc",
    "transactionHash": "0x3ef2b558187ea6660ad9f7399b1871240e94b4f6826abd797ff1b39db6fefb03",
    "logs": [],
    "blockNumber": 2,
    "cumulativeGasUsed": "825448",
    "status": 1,
    "byzantium": true
  },
  "args": [
    "0x5FbDB2315678afecb367f032d93F642f64180aa3"
  ],
  "numDeployments": 1,
  "solcInputHash": "e777a8d419c65081813f177b07d7a0d7",
  "metadata": "{\"compiler\":{\"version\":\"0.8.24+commit.e11b9ed9\"},\"language\":\"Solidity\",\"output\":{\"abi\":[{\"inputs\":[{\"internalType\":\"address\",\"name\":\"priceFeedAddress\",\"type\":\"address\"}],\"stateMutability\":\"nonpayable\",\"type\":\"constructor\"},{\"inputs\":[],\"name\":\"FundMe__CallFailed\",\"type\":\"error\"},{\"inputs\":[{\"internalType\":\"uint256\",\"name\":\"ethProvided\",\"type\":\"uint256\"},{\"internalType\":\"uint256\",\"name\":\"minEth\",\"type\":\"uint256\"}],\"name\":\"FundMe__NotEnoughETH\",\"type\":\"error\"},{\"inputs\":[],\"name\":\"FundMe__NotOwner\",\"type\":\"error\"},{\"stateMutability\":\"payable\",\"type\":\"fallback\"},{\"inputs\":[],\"name\":\"MINIMUM_USD\",\"outputs\":[{\"internalType\":\"uint256\",\"name\":\"\",\"type\":\"uint256\"}],\"stateMutability\":\"view\",\"type\":\"function\"},{\"inputs\":[],\"name\":\"OWNER\",\"outputs\":[{\"internalType\":\"address\",\"name\":\"\",\"type\":\"address\"}],\"stateMutability\":\"view\",\"type\":\"function\"},{\"inputs\":[{\"internalType\":\"address\",\"name\":\"\",\"type\":\"address\"}],\"name\":\"addressToAmountFunded\",\"outputs\":[{\"internalType\":\"uint256\",\"name\":\"\",\"type\":\"uint256\"}],\"stateMutability\":\"view\",\"type\":\"function\"},{\"inputs\":[{\"internalType\":\"uint256\",\"name\":\"\",\"type\":\"uint256\"}],\"name\":\"founders\",\"outputs\":[{\"internalType\":\"address\",\"name\":\"\",\"type\":\"address\"}],\"stateMutability\":\"view\",\"type\":\"function\"},{\"inputs\":[],\"name\":\"fund\",\"outputs\":[],\"stateMutability\":\"payable\",\"type\":\"function\"},{\"inputs\":[],\"name\":\"getVersion\",\"outputs\":[{\"internalType\":\"uint256\",\"name\":\"\",\"type\":\"uint256\"}],\"stateMutability\":\"view\",\"type\":\"function\"},{\"inputs\":[],\"name\":\"priceFeed\",\"outputs\":[{\"internalType\":\"contract AggregatorV3Interface\",\"name\":\"\",\"type\":\"address\"}],\"stateMutability\":\"view\",\"type\":\"function\"},{\"inputs\":[],\"name\":\"withdraw\",\"outputs\":[],\"stateMutability\":\"nonpayable\",\"type\":\"function\"},{\"stateMutability\":\"payable\",\"type\":\"receive\"}],\"devdoc\":{\"author\":\"Ricardo Almeida\",\"details\":\"This implements price feeds as our library\",\"errors\":{\"FundMe__NotEnoughETH(uint256,uint256)\":[{\"params\":{\"ethProvided\":\"The initial amount provided in the call\",\"minEth\":\"The minimum value expected\"}}]},\"kind\":\"dev\",\"methods\":{\"fund()\":{\"details\":\"This implements price feed as our library\"},\"getVersion()\":{\"returns\":{\"_0\":\"uint256 The version of the price feed service in use\"}}},\"title\":\"A contract for crowd funding\",\"version\":1},\"userdoc\":{\"errors\":{\"FundMe__CallFailed()\":[{\"notice\":\"Custom error for when a FundMe.withdraw call fails\"}],\"FundMe__NotEnoughETH(uint256,uint256)\":[{\"notice\":\"Custom error for when a call to the FundMe.fund() function is placed with insufficient funds.\"}],\"FundMe__NotOwner()\":[{\"notice\":\"Custom error for whenever anyone other than the contract owner tries to take ownership of the resource\"}]},\"kind\":\"user\",\"methods\":{\"fund()\":{\"notice\":\"This function funds this contract\"},\"getVersion()\":{\"notice\":\"This function returns the version of the price feed service.\"},\"withdraw()\":{\"notice\":\"This function withdraws all the funds set so far into the owner's account.\"}},\"notice\":\"This contract is to demo a sample funding contract\",\"version\":1}},\"settings\":{\"compilationTarget\":{\"contracts/FundMe.sol\":\"FundMe\"},\"evmVersion\":\"paris\",\"libraries\":{},\"metadata\":{\"bytecodeHash\":\"ipfs\",\"useLiteralContent\":true},\"optimizer\":{\"enabled\":false,\"runs\":200},\"remappings\":[]},\"sources\":{\"@chainlink/contracts/src/v0.8/shared/interfaces/AggregatorV3Interface.sol\":{\"content\":\"// SPDX-License-Identifier: MIT\\npragma solidity ^0.8.0;\\n\\ninterface AggregatorV3Interface {\\n  function decimals() external view returns (uint8);\\n\\n  function description() external view returns (string memory);\\n\\n  function version() external view returns (uint256);\\n\\n  function getRoundData(\\n    uint80 _roundId\\n  ) external view returns (uint80 roundId, int256 answer, uint256 startedAt, uint256 updatedAt, uint80 answeredInRound);\\n\\n  function latestRoundData()\\n    external\\n    view\\n    returns (uint80 roundId, int256 answer, uint256 startedAt, uint256 updatedAt, uint80 answeredInRound);\\n}\\n\",\"keccak256\":\"0xfe4e8bb4861bb3860ba890ab91a3b818ec66e5a8f544fb608cfcb73f433472cd\",\"license\":\"MIT\"},\"contracts/FundMe.sol\":{\"content\":\"// Pragma\\n// SPDX-License-Identifier: MIT\\npragma solidity ^0.8.24;\\n\\n// Imports\\nimport {AggregatorV3Interface} from \\\"@chainlink/contracts/src/v0.8/shared/interfaces/AggregatorV3Interface.sol\\\";\\nimport {PriceConverter} from \\\"./PriceConverter.sol\\\";\\n\\n// Error Codes\\n\\n/// @notice Custom error for whenever anyone other than the contract owner tries to take ownership of the resource\\nerror FundMe__NotOwner();\\n\\n/**\\n    @notice Custom error for when a call to the FundMe.fund() function is placed with insufficient funds.\\n    @param ethProvided The initial amount provided in the call\\n    @param minEth The minimum value expected\\n*/\\nerror FundMe__NotEnoughETH(uint256 ethProvided, uint256 minEth);\\n\\n/// @notice Custom error for when a FundMe.withdraw call fails\\nerror FundMe__CallFailed();\\n\\n/// @notice Test custom error\\nerror FundMe__NonExistentFunction();\\n\\n// Interfaces\\n\\n// Libraries\\n\\n// Contracts\\n/**\\n    @title A contract for crowd funding\\n    @author Ricardo Almeida\\n    @notice This contract is to demo a sample funding contract\\n    @dev This implements price feeds as our library\\n*/\\ncontract FundMe {\\n    // Type Declarations\\n    // This is the statement that allows line 25, where the \\\"getConversionRate\\\" function is called from a uint256 value (msg.value)\\n    using PriceConverter for uint256;\\n\\n    // State Variables\\n    mapping(address => uint256) public addressToAmountFunded;\\n    address[] public founders;\\n    // Could we make this constant? No! We should make it immutable!\\n    address public immutable OWNER;\\n    // Minimum ETH to send, as USD\\n    uint256 public constant MINIMUM_USD = 5 * 10 ** 18; // 50 * 10 ** 18 = 50e18 = 50000000000000000000;\\n    AggregatorV3Interface public priceFeed;\\n\\n    // Events\\n\\n    // Modifiers\\n    modifier onlyOwner() {\\n        // NOTE: NotOwner is a custom error defined at the top of this module.\\n        if (msg.sender != OWNER) revert FundMe__NotOwner();\\n        _;\\n    }\\n\\n    // Functions Order:\\n    // constructor\\n    // receive\\n    // fallback\\n    // external\\n    // public\\n    // internal\\n    // private\\n    // view/pure\\n\\n    constructor(address priceFeedAddress) {\\n        OWNER = msg.sender;\\n        priceFeed = AggregatorV3Interface(priceFeedAddress);\\n    }\\n\\n    /**\\n        @notice This function funds this contract\\n        @dev This implements price feed as our library\\n    */\\n    function fund() public payable {\\n        /*\\n            This one is particularly messy, even in Javascript terms...\\n            So, the 'getConversionRate' function is obtained from the PriceConverter.sol module. Normal, decent programming\\n            languages typically specify this somewhere, but not Javascript! Oh no, with fucking Javascript you have to 'guess'\\n            it, you need divination skills to work with this shit...\\n            So, is this it? Is this the whole spectrum of messiness you're talking about??\\n            Fuck no! This is just an apetizer!\\n            \\n            Next comes the weirdest thing I ever saw as a software engineer:\\n            So, 'getConversionRate' takes two arguments: a uint256 amount and an AggregatorV3Interface object named priceFeed. So far so good\\n            But, by some stupid reason, the first argument is 'passed' by... (I need to breathe deeply first) calling the function from\\n            the argument.. HOW IS THIS LOGIC????? WHO THE FUCK CAME UP WITH THIS STUPIDITY???? THIS GOES AGAINST EVERY SINGLE NOTION\\n            OF GOOD SOFTWARE WRITTING!\\n            So, not only you have to find out where the fuck the 'getConversionRate' comes from, but you also have to take into account\\n            that, UNLINKE EVERY DECENT AND LOGIC PROGRAMMING LANGUAGE OUT THERE (including fucking PhP!!!!!), you can invoke a function\\n            from a non-object, like an uint256, and when you do, the first argument (but not the second or any other after) is actually\\n            actually that value??? This is madness I tell you...\\n            OK, confusing enough... But what if the function has more than one input?\\n            Well, if that is the case, Javascript simply becomes exponentially more stupid to solve that! How do you provide the second argument???\\n            By doing it as if it was the first, i.e., inside parethesis...\\n            But what about the first argument? Should it also go inside the parenthesis as well?\\n            One would assume so, if the rules of logic and decency where applicable in this bullshit of a programming language, but no,\\n            apparently one can pass two arguments to one function as such:\\n\\n            msg.value.getConversionRate(priceFeed)\\n\\n            So, just to sum up this mess:\\n                \\u00b7 getConversionRate is a function from the PriceConverter.sol contract. In a normal programming language, you would\\n                invoke it like:\\n                    \\n                    var answer = PriceConverter.getConversionRate(arg1, arg2);\\n                \\n                But in fucking Javascript, its whatever...\\n\\n            \\u00b7 msg.value is actually arg1, which if you look at the function signature, it has to be a uint256 value. The weird\\n            thing is that you can invoke the function from addressing the input argument! There must be 2 situations in the whole\\n            wide world where this approach was actually efficient, but that is enough to make this a valid call in fucking Javascript\\n\\n            \\u00b7 priceFeed is arg2 and the only 'normal' thing in this bullshit, if you ignore the fact that arg2 is passed as arg1...\\n\\n            Uff.. that's about it. I need these cathartic notes here and there because working with Javascript is often a mystery.\\n        */\\n        uint256 ethProvided = msg.value.getConversionRate(priceFeed);\\n\\n        if (ethProvided <= MINIMUM_USD) {\\n            revert FundMe__NotEnoughETH(ethProvided, MINIMUM_USD);\\n        }\\n\\n        addressToAmountFunded[msg.sender] += msg.value;\\n        founders.push(msg.sender);\\n    }\\n\\n    /**\\n        @notice This function returns the version of the price feed service.\\n        @return uint256 The version of the price feed service in use\\n    */\\n    function getVersion() public view returns (uint256) {\\n        // ETH/USD price feed address of Sepolia Network\\n        return priceFeed.version();\\n    }\\n\\n    /**\\n        @notice This function withdraws all the funds set so far into the owner's account.\\n    */\\n    function withdraw() public onlyOwner {\\n        // Go through all the founders so far\\n        for (\\n            uint256 founderIndex = 0;\\n            founderIndex < founders.length;\\n            founderIndex++\\n        ) {\\n            // And one by one, extract the address of a founder\\n            address founder = founders[founderIndex];\\n\\n            // And set all the funds sent so far to 0\\n            addressToAmountFunded[founder] = 0;\\n        }\\n\\n        // Reset the array of founders\\n        founders = new address[](0);\\n\\n        /* \\n            Apparentely there are several ways to achieve the next objective, namely, to send all the funds from the individual\\n            founders to this contract. This is the \\\"older\\\" version using a delegated call (I think...)\\n\\n            payable(msg.sender).transfer(address(this).balance);\\n\\n            bool sendSuccess = payable(msg.sender).send(address(this).balance);\\n            require(sendSuccess, \\\"Send failed\\\");\\n\\n            call\\n        */\\n\\n        // This version is more \\\"secure\\\", apparentely...\\n        (bool callSuccess, ) = payable(msg.sender).call{\\n            value: address(this).balance\\n        }(\\\"\\\");\\n\\n        if (!callSuccess) {\\n            revert FundMe__CallFailed();\\n        }\\n    }\\n\\n    /**\\n        @notice Standard fallback function to be executed when no other path is available for the smart contract execution.\\n    */\\n    fallback() external payable {\\n        fund();\\n    }\\n\\n    /**\\n        @notice Standard receive function to be used as it is indicated.\\n    */\\n    receive() external payable {\\n        fund();\\n    }\\n}\\n\",\"keccak256\":\"0xc9448bac934abd4e954799f16f184483505fd3a1acd16370cc9723f220fcd586\",\"license\":\"MIT\"},\"contracts/PriceConverter.sol\":{\"content\":\"// SPDX-License-Identifier: MIT\\n\\npragma solidity ^0.8.8;\\n\\nimport {AggregatorV3Interface} from \\\"@chainlink/contracts/src/v0.8/shared/interfaces/AggregatorV3Interface.sol\\\";\\n// import {FundMe} from \\\"./FundMe.sol\\\";\\n\\nlibrary PriceConverter {\\n    // We could make this public, but then we'd have to deploy it\\n    function getPrice(\\n        AggregatorV3Interface priceFeed\\n    ) internal view returns (uint256) {\\n        // Sepolia ETH / USD Address\\n\\n        (, int256 answer, , , ) = priceFeed.latestRoundData();\\n        // ETH/USD rate in 18 digit\\n\\n        return uint256(answer * 1e10); // 1e10 = 10000000000\\n    }\\n\\n    function getConversionRate(\\n        uint256 ethAmount,\\n        AggregatorV3Interface priceFeed\\n    ) internal view returns (uint256) {\\n        uint256 ethPrice = getPrice(priceFeed);\\n        uint256 ethAmountInUsd = (ethPrice * ethAmount) / 1e18; // 1e18 = 1000000000000000000\\n\\n        return ethAmountInUsd;\\n    }\\n}\\n\",\"keccak256\":\"0xaec249cdfffd78ce3130f6e9eaa4c68405e9a325996e5329c93239b5ae3c844a\",\"license\":\"MIT\"}},\"version\":1}",
  "bytecode": "0x60a060405234801561001057600080fd5b50604051610ee8380380610ee883398181016040528101906100329190610110565b3373ffffffffffffffffffffffffffffffffffffffff1660808173ffffffffffffffffffffffffffffffffffffffff168152505080600260006101000a81548173ffffffffffffffffffffffffffffffffffffffff021916908373ffffffffffffffffffffffffffffffffffffffff1602179055505061013d565b600080fd5b600073ffffffffffffffffffffffffffffffffffffffff82169050919050565b60006100dd826100b2565b9050919050565b6100ed816100d2565b81146100f857600080fd5b50565b60008151905061010a816100e4565b92915050565b600060208284031215610126576101256100ad565b5b6000610134848285016100fb565b91505092915050565b608051610d8961015f600039600081816103c301526103e70152610d896000f3fe60806040526004361061007f5760003560e01c80636b69a5921161004e5780636b69a59214610142578063741bef1a1461016d578063b60d428814610198578063d8e75f62146101a25761008e565b80630d8e6e2c14610098578063117803e3146100c35780633ccfd60b146100ee5780633e47d6f3146101055761008e565b3661008e5761008c6101df565b005b6100966101df565b005b3480156100a457600080fd5b506100ad610329565b6040516100ba919061082c565b60405180910390f35b3480156100cf57600080fd5b506100d86103c1565b6040516100e59190610888565b60405180910390f35b3480156100fa57600080fd5b506101036103e5565b005b34801561011157600080fd5b5061012c600480360381019061012791906108d4565b610616565b604051610139919061082c565b60405180910390f35b34801561014e57600080fd5b5061015761062e565b604051610164919061082c565b60405180910390f35b34801561017957600080fd5b5061018261063a565b60405161018f9190610960565b60405180910390f35b6101a06101df565b005b3480156101ae57600080fd5b506101c960048036038101906101c491906109a7565b610660565b6040516101d69190610888565b60405180910390f35b6000610216600260009054906101000a900473ffffffffffffffffffffffffffffffffffffffff163461069f90919063ffffffff16565b9050674563918244f40000811161026e5780674563918244f400006040517ffcf394990000000000000000000000000000000000000000000000000000000081526004016102659291906109d4565b60405180910390fd5b346000803373ffffffffffffffffffffffffffffffffffffffff1673ffffffffffffffffffffffffffffffffffffffff16815260200190815260200160002060008282546102bc9190610a2c565b925050819055506001339080600181540180825580915050600190039060005260206000200160009091909190916101000a81548173ffffffffffffffffffffffffffffffffffffffff021916908373ffffffffffffffffffffffffffffffffffffffff16021790555050565b6000600260009054906101000a900473ffffffffffffffffffffffffffffffffffffffff1673ffffffffffffffffffffffffffffffffffffffff166354fd4d506040518163ffffffff1660e01b8152600401602060405180830381865afa158015610398573d6000803e3d6000fd5b505050506040513d601f19601f820116820180604052508101906103bc9190610a75565b905090565b7f000000000000000000000000000000000000000000000000000000000000000081565b7f000000000000000000000000000000000000000000000000000000000000000073ffffffffffffffffffffffffffffffffffffffff163373ffffffffffffffffffffffffffffffffffffffff161461046a576040517f579610db00000000000000000000000000000000000000000000000000000000815260040160405180910390fd5b60005b60018054905081101561050f576000600182815481106104905761048f610aa2565b5b9060005260206000200160009054906101000a900473ffffffffffffffffffffffffffffffffffffffff16905060008060008373ffffffffffffffffffffffffffffffffffffffff1673ffffffffffffffffffffffffffffffffffffffff1681526020019081526020016000208190555050808060010191505061046d565b50600067ffffffffffffffff81111561052b5761052a610ad1565b5b6040519080825280602002602001820160405280156105595781602001602082028036833780820191505090505b506001908051906020019061056f92919061076c565b5060003373ffffffffffffffffffffffffffffffffffffffff164760405161059690610b31565b60006040518083038185875af1925050503d80600081146105d3576040519150601f19603f3d011682016040523d82523d6000602084013e6105d8565b606091505b5050905080610613576040517fa6139a6400000000000000000000000000000000000000000000000000000000815260040160405180910390fd5b50565b60006020528060005260406000206000915090505481565b674563918244f4000081565b600260009054906101000a900473ffffffffffffffffffffffffffffffffffffffff1681565b6001818154811061067057600080fd5b906000526020600020016000915054906101000a900473ffffffffffffffffffffffffffffffffffffffff1681565b6000806106ab836106db565b90506000670de0b6b3a764000085836106c49190610b46565b6106ce9190610bb7565b9050809250505092915050565b6000808273ffffffffffffffffffffffffffffffffffffffff1663feaf968c6040518163ffffffff1660e01b815260040160a060405180830381865afa158015610729573d6000803e3d6000fd5b505050506040513d601f19601f8201168201806040525081019061074d9190610c60565b5050509150506402540be400816107649190610cdb565b915050919050565b8280548282559060005260206000209081019282156107e5579160200282015b828111156107e45782518260006101000a81548173ffffffffffffffffffffffffffffffffffffffff021916908373ffffffffffffffffffffffffffffffffffffffff1602179055509160200191906001019061078c565b5b5090506107f291906107f6565b5090565b5b8082111561080f5760008160009055506001016107f7565b5090565b6000819050919050565b61082681610813565b82525050565b6000602082019050610841600083018461081d565b92915050565b600073ffffffffffffffffffffffffffffffffffffffff82169050919050565b600061087282610847565b9050919050565b61088281610867565b82525050565b600060208201905061089d6000830184610879565b92915050565b600080fd5b6108b181610867565b81146108bc57600080fd5b50565b6000813590506108ce816108a8565b92915050565b6000602082840312156108ea576108e96108a3565b5b60006108f8848285016108bf565b91505092915050565b6000819050919050565b600061092661092161091c84610847565b610901565b610847565b9050919050565b60006109388261090b565b9050919050565b600061094a8261092d565b9050919050565b61095a8161093f565b82525050565b60006020820190506109756000830184610951565b92915050565b61098481610813565b811461098f57600080fd5b50565b6000813590506109a18161097b565b92915050565b6000602082840312156109bd576109bc6108a3565b5b60006109cb84828501610992565b91505092915050565b60006040820190506109e9600083018561081d565b6109f6602083018461081d565b9392505050565b7f4e487b7100000000000000000000000000000000000000000000000000000000600052601160045260246000fd5b6000610a3782610813565b9150610a4283610813565b9250828201905080821115610a5a57610a596109fd565b5b92915050565b600081519050610a6f8161097b565b92915050565b600060208284031215610a8b57610a8a6108a3565b5b6000610a9984828501610a60565b91505092915050565b7f4e487b7100000000000000000000000000000000000000000000000000000000600052603260045260246000fd5b7f4e487b7100000000000000000000000000000000000000000000000000000000600052604160045260246000fd5b600081905092915050565b50565b6000610b1b600083610b00565b9150610b2682610b0b565b600082019050919050565b6000610b3c82610b0e565b9150819050919050565b6000610b5182610813565b9150610b5c83610813565b9250828202610b6a81610813565b91508282048414831517610b8157610b806109fd565b5b5092915050565b7f4e487b7100000000000000000000000000000000000000000000000000000000600052601260045260246000fd5b6000610bc282610813565b9150610bcd83610813565b925082610bdd57610bdc610b88565b5b828204905092915050565b600069ffffffffffffffffffff82169050919050565b610c0781610be8565b8114610c1257600080fd5b50565b600081519050610c2481610bfe565b92915050565b6000819050919050565b610c3d81610c2a565b8114610c4857600080fd5b50565b600081519050610c5a81610c34565b92915050565b600080600080600060a08688031215610c7c57610c7b6108a3565b5b6000610c8a88828901610c15565b9550506020610c9b88828901610c4b565b9450506040610cac88828901610a60565b9350506060610cbd88828901610a60565b9250506080610cce88828901610c15565b9150509295509295909350565b6000610ce682610c2a565b9150610cf183610c2a565b9250828202610cff81610c2a565b91507f80000000000000000000000000000000000000000000000000000000000000008414600084121615610d3757610d366109fd565b5b8282058414831517610d4c57610d4b6109fd565b5b509291505056fea2646970667358221220e834e49e65bdf6916bd2db8e287645db61c3a15e94bed6f559ccc3c20bffa54e64736f6c63430008180033",
  "deployedBytecode": "0x60806040526004361061007f5760003560e01c80636b69a5921161004e5780636b69a59214610142578063741bef1a1461016d578063b60d428814610198578063d8e75f62146101a25761008e565b80630d8e6e2c14610098578063117803e3146100c35780633ccfd60b146100ee5780633e47d6f3146101055761008e565b3661008e5761008c6101df565b005b6100966101df565b005b3480156100a457600080fd5b506100ad610329565b6040516100ba919061082c565b60405180910390f35b3480156100cf57600080fd5b506100d86103c1565b6040516100e59190610888565b60405180910390f35b3480156100fa57600080fd5b506101036103e5565b005b34801561011157600080fd5b5061012c600480360381019061012791906108d4565b610616565b604051610139919061082c565b60405180910390f35b34801561014e57600080fd5b5061015761062e565b604051610164919061082c565b60405180910390f35b34801561017957600080fd5b5061018261063a565b60405161018f9190610960565b60405180910390f35b6101a06101df565b005b3480156101ae57600080fd5b506101c960048036038101906101c491906109a7565b610660565b6040516101d69190610888565b60405180910390f35b6000610216600260009054906101000a900473ffffffffffffffffffffffffffffffffffffffff163461069f90919063ffffffff16565b9050674563918244f40000811161026e5780674563918244f400006040517ffcf394990000000000000000000000000000000000000000000000000000000081526004016102659291906109d4565b60405180910390fd5b346000803373ffffffffffffffffffffffffffffffffffffffff1673ffffffffffffffffffffffffffffffffffffffff16815260200190815260200160002060008282546102bc9190610a2c565b925050819055506001339080600181540180825580915050600190039060005260206000200160009091909190916101000a81548173ffffffffffffffffffffffffffffffffffffffff021916908373ffffffffffffffffffffffffffffffffffffffff16021790555050565b6000600260009054906101000a900473ffffffffffffffffffffffffffffffffffffffff1673ffffffffffffffffffffffffffffffffffffffff166354fd4d506040518163ffffffff1660e01b8152600401602060405180830381865afa158015610398573d6000803e3d6000fd5b505050506040513d601f19601f820116820180604052508101906103bc9190610a75565b905090565b7f000000000000000000000000000000000000000000000000000000000000000081565b7f000000000000000000000000000000000000000000000000000000000000000073ffffffffffffffffffffffffffffffffffffffff163373ffffffffffffffffffffffffffffffffffffffff161461046a576040517f579610db00000000000000000000000000000000000000000000000000000000815260040160405180910390fd5b60005b60018054905081101561050f576000600182815481106104905761048f610aa2565b5b9060005260206000200160009054906101000a900473ffffffffffffffffffffffffffffffffffffffff16905060008060008373ffffffffffffffffffffffffffffffffffffffff1673ffffffffffffffffffffffffffffffffffffffff1681526020019081526020016000208190555050808060010191505061046d565b50600067ffffffffffffffff81111561052b5761052a610ad1565b5b6040519080825280602002602001820160405280156105595781602001602082028036833780820191505090505b506001908051906020019061056f92919061076c565b5060003373ffffffffffffffffffffffffffffffffffffffff164760405161059690610b31565b60006040518083038185875af1925050503d80600081146105d3576040519150601f19603f3d011682016040523d82523d6000602084013e6105d8565b606091505b5050905080610613576040517fa6139a6400000000000000000000000000000000000000000000000000000000815260040160405180910390fd5b50565b60006020528060005260406000206000915090505481565b674563918244f4000081565b600260009054906101000a900473ffffffffffffffffffffffffffffffffffffffff1681565b6001818154811061067057600080fd5b906000526020600020016000915054906101000a900473ffffffffffffffffffffffffffffffffffffffff1681565b6000806106ab836106db565b90506000670de0b6b3a764000085836106c49190610b46565b6106ce9190610bb7565b9050809250505092915050565b6000808273ffffffffffffffffffffffffffffffffffffffff1663feaf968c6040518163ffffffff1660e01b815260040160a060405180830381865afa158015610729573d6000803e3d6000fd5b505050506040513d601f19601f8201168201806040525081019061074d9190610c60565b5050509150506402540be400816107649190610cdb565b915050919050565b8280548282559060005260206000209081019282156107e5579160200282015b828111156107e45782518260006101000a81548173ffffffffffffffffffffffffffffffffffffffff021916908373ffffffffffffffffffffffffffffffffffffffff1602179055509160200191906001019061078c565b5b5090506107f291906107f6565b5090565b5b8082111561080f5760008160009055506001016107f7565b5090565b6000819050919050565b61082681610813565b82525050565b6000602082019050610841600083018461081d565b92915050565b600073ffffffffffffffffffffffffffffffffffffffff82169050919050565b600061087282610847565b9050919050565b61088281610867565b82525050565b600060208201905061089d6000830184610879565b92915050565b600080fd5b6108b181610867565b81146108bc57600080fd5b50565b6000813590506108ce816108a8565b92915050565b6000602082840312156108ea576108e96108a3565b5b60006108f8848285016108bf565b91505092915050565b6000819050919050565b600061092661092161091c84610847565b610901565b610847565b9050919050565b60006109388261090b565b9050919050565b600061094a8261092d565b9050919050565b61095a8161093f565b82525050565b60006020820190506109756000830184610951565b92915050565b61098481610813565b811461098f57600080fd5b50565b6000813590506109a18161097b565b92915050565b6000602082840312156109bd576109bc6108a3565b5b60006109cb84828501610992565b91505092915050565b60006040820190506109e9600083018561081d565b6109f6602083018461081d565b9392505050565b7f4e487b7100000000000000000000000000000000000000000000000000000000600052601160045260246000fd5b6000610a3782610813565b9150610a4283610813565b9250828201905080821115610a5a57610a596109fd565b5b92915050565b600081519050610a6f8161097b565b92915050565b600060208284031215610a8b57610a8a6108a3565b5b6000610a9984828501610a60565b91505092915050565b7f4e487b7100000000000000000000000000000000000000000000000000000000600052603260045260246000fd5b7f4e487b7100000000000000000000000000000000000000000000000000000000600052604160045260246000fd5b600081905092915050565b50565b6000610b1b600083610b00565b9150610b2682610b0b565b600082019050919050565b6000610b3c82610b0e565b9150819050919050565b6000610b5182610813565b9150610b5c83610813565b9250828202610b6a81610813565b91508282048414831517610b8157610b806109fd565b5b5092915050565b7f4e487b7100000000000000000000000000000000000000000000000000000000600052601260045260246000fd5b6000610bc282610813565b9150610bcd83610813565b925082610bdd57610bdc610b88565b5b828204905092915050565b600069ffffffffffffffffffff82169050919050565b610c0781610be8565b8114610c1257600080fd5b50565b600081519050610c2481610bfe565b92915050565b6000819050919050565b610c3d81610c2a565b8114610c4857600080fd5b50565b600081519050610c5a81610c34565b92915050565b600080600080600060a08688031215610c7c57610c7b6108a3565b5b6000610c8a88828901610c15565b9550506020610c9b88828901610c4b565b9450506040610cac88828901610a60565b9350506060610cbd88828901610a60565b9250506080610cce88828901610c15565b9150509295509295909350565b6000610ce682610c2a565b9150610cf183610c2a565b9250828202610cff81610c2a565b91507f80000000000000000000000000000000000000000000000000000000000000008414600084121615610d3757610d366109fd565b5b8282058414831517610d4c57610d4b6109fd565b5b509291505056fea2646970667358221220e834e49e65bdf6916bd2db8e287645db61c3a15e94bed6f559ccc3c20bffa54e64736f6c63430008180033",
  "devdoc": {
    "author": "Ricardo Almeida",
    "details": "This implements price feeds as our library",
    "errors": {
      "FundMe__NotEnoughETH(uint256,uint256)": [
        {
          "params": {
            "ethProvided": "The initial amount provided in the call",
            "minEth": "The minimum value expected"
          }
        }
      ]
    },
    "kind": "dev",
    "methods": {
      "fund()": {
        "details": "This implements price feed as our library"
      },
      "getVersion()": {
        "returns": {
          "_0": "uint256 The version of the price feed service in use"
        }
      }
    },
    "title": "A contract for crowd funding",
    "version": 1
  },
  "userdoc": {
    "errors": {
      "FundMe__CallFailed()": [
        {
          "notice": "Custom error for when a FundMe.withdraw call fails"
        }
      ],
      "FundMe__NotEnoughETH(uint256,uint256)": [
        {
          "notice": "Custom error for when a call to the FundMe.fund() function is placed with insufficient funds."
        }
      ],
      "FundMe__NotOwner()": [
        {
          "notice": "Custom error for whenever anyone other than the contract owner tries to take ownership of the resource"
        }
      ]
    },
    "kind": "user",
    "methods": {
      "fund()": {
        "notice": "This function funds this contract"
      },
      "getVersion()": {
        "notice": "This function returns the version of the price feed service."
      },
      "withdraw()": {
        "notice": "This function withdraws all the funds set so far into the owner's account."
      }
    },
    "notice": "This contract is to demo a sample funding contract",
    "version": 1
  },
  "storageLayout": {
    "storage": [
      {
        "astId": 340,
        "contract": "contracts/FundMe.sol:FundMe",
        "label": "addressToAmountFunded",
        "offset": 0,
        "slot": "0",
        "type": "t_mapping(t_address,t_uint256)"
      },
      {
        "astId": 343,
        "contract": "contracts/FundMe.sol:FundMe",
        "label": "founders",
        "offset": 0,
        "slot": "1",
        "type": "t_array(t_address)dyn_storage"
      },
      {
        "astId": 355,
        "contract": "contracts/FundMe.sol:FundMe",
        "label": "priceFeed",
        "offset": 0,
        "slot": "2",
        "type": "t_contract(AggregatorV3Interface)104"
      }
    ],
    "types": {
      "t_address": {
        "encoding": "inplace",
        "label": "address",
        "numberOfBytes": "20"
      },
      "t_array(t_address)dyn_storage": {
        "base": "t_address",
        "encoding": "dynamic_array",
        "label": "address[]",
        "numberOfBytes": "32"
      },
      "t_contract(AggregatorV3Interface)104": {
        "encoding": "inplace",
        "label": "contract AggregatorV3Interface",
        "numberOfBytes": "20"
      },
      "t_mapping(t_address,t_uint256)": {
        "encoding": "mapping",
        "key": "t_address",
        "label": "mapping(address => uint256)",
        "numberOfBytes": "32",
        "value": "t_uint256"
      },
      "t_uint256": {
        "encoding": "inplace",
        "label": "uint256",
        "numberOfBytes": "32"
      }
    }
  }
}